<JobUsageRecord xmlns:cha='http://safe.epcc.ed.ac.uk/chart'
	xmlns:ds='http://www.w3.org/2000/09/xmldsig#' 
	xmlns:tab='http://safe.epcc.ed.ac.uk/table'
	xmlns:fmt='http://safe.epcc.ed.ac.uk/format' 
	xmlns:per='http://safe.epcc.ed.ac.uk/period'
	xmlns:xsi='http://www.w3.org/2001/XMLSchema-instance'
	xmlns:par='http://safe.epcc.ed.ac.uk/parameter' 
	xmlns:rep='http://safe.epcc.ed.ac.uk/report'
	xmlns:ato='http://safe.epcc.ed.ac.uk/atom' 
	xmlns:fil='http://safe.epcc.ed.ac.uk/filter'
	xmlns:urwg="http://www.gridforum.org/2003/ur-wg"
	xmlns='http://www.gridforum.org/2003/ur-wg'
	xsi:schemaLocation="http://www.gridforum.org/2003/ur-wg urwg-schema.11.xsd"
	>
	<RecordIdentity 
		urwg:recordId='2009-07-02T23:01:11Z:199323.vidar@mymachine.ngs.example.com'
		urwg:createTime='2010-12-07T11:05:52Z'
		></RecordIdentity>
	<JobIdentity>
		<LocalJobId>199323.vidar</LocalJobId>
	</JobIdentity>
	<UserIdentity>
		<LocalUserId>ngs0193</LocalUserId>
		<KeyInfo xmlns='http://www.w3.org/2000/09/xmldsig#'>
			<X509Data>
				<X509SubjectName>/C=UK/O=eScience/OU=Edinburgh/L=NeSC/CN=portal/cleopatra.cap.ed.ac.uk/emailAddress=jgrunche@staffmail.ed.ac.uk
				</X509SubjectName>
			</X509Data>
		</KeyInfo>
	</UserIdentity>
	<JobName>STDIN</JobName>
	<Status>completed</Status>
	<Memory urwg:storageUnit='KB' urwg:type='memoryUsed'>916</Memory>
	<Memory urwg:storageUnit='KB' urwg:type='virtualMemoryUsed'>6508</Memory>
	<TimeInstant urwg:type='timeGlobusSubmitted'>2009-07-02T23:01:11Z</TimeInstant>
	<TimeInstant urwg:type='timeGlobusExecutable'>2009-07-02T23:01:11Z</TimeInstant>
	<TimeInstant urwg:type='timeGlobusFinished'>2009-07-02T23:01:22Z</TimeInstant>
	<TimeInstant urwg:type='BatchSubmittedTimestamp'>2009-07-02T23:01:11Z</TimeInstant>
	<WallDuration>PT1S</WallDuration>
	<Processors>1</Processors>
	<EndTime>2009-07-02T23:01:12Z</EndTime>
	<StartTime>2009-07-02T23:01:11Z</StartTime>
	<MachineName>mymachine.ngs.example.com</MachineName>
	<SubmitHost>129.215.190.68</SubmitHost>
	<Queue>workq</Queue>
	<Resource urwg:description='VOinfo'>vomss://voms.ngs.ac.uk:8443/voms/ngs.ac.uk</Resource>
</JobUsageRecord>